{
  "schema_version": "1.0.0",
  "format": "mymodhub.racemenu.morphs.v1",
  "id": "soft_nord_glow",
  "name": "Soft Nord Glow",
  "description": "Feminine balance pass: gentle cheek lift, softer jaw, calmer brow, clean profile. Morphs only.",
  "units": "normalized",
  "defaults": {
    "apply_mode": "clamped_additive",
    "strength": 1.0,
    "clamp_min": -1.0,
    "clamp_max": 1.0,
    "skip_missing_sliders": true
  },
  "targets": [
    {
      "type": "cheeks",
      "sliders": [
        { "key": "Cheekbone Height", "value": 0.18 },
        { "key": "Cheekbone Width", "value": -0.10 },
        { "key": "Cheek Depth", "value": 0.12 }
      ]
    },
    {
      "type": "jaw",
      "sliders": [
        { "key": "Jaw Width", "value": -0.22 },
        { "key": "Jaw Height", "value": 0.08 },
        { "key": "Jaw Forward", "value": -0.06 }
      ]
    },
    {
      "type": "chin",
      "sliders": [
        { "key": "Chin Length", "value": -0.10 },
        { "key": "Chin Width", "value": -0.14 },
        { "key": "Chin Forward", "value": -0.05 }
      ]
    },
    {
      "type": "eyes",
      "sliders": [
        { "key": "Eye Height", "value": 0.06 },
        { "key": "Eye Width", "value": 0.08 },
        { "key": "Eye Depth", "value": -0.06 }
      ]
    },
    {
      "type": "nose",
      "sliders": [
        { "key": "Nose Length", "value": -0.06 },
        { "key": "Nose Height", "value": 0.04 },
        { "key": "Nose Width", "value": -0.08 }
      ]
    },
    {
      "type": "mouth",
      "sliders": [
        { "key": "Mouth Width", "value": 0.06 },
        { "key": "Mouth Height", "value": 0.04 },
        { "key": "Lip Fullness", "value": 0.10 }
      ]
    }
  ],
  "meta": {
    "created_at": "2026-01-06T00:00:00Z",
    "source": "mymodhub generator",
    "author_notes": "Does not touch headparts (hair/eyes/brows). Safe to combine with user-selected parts."
  }
}
